{"$id":"https://orbital-dynamics.local/schemas/timeline_activity_precondition_summary.v1.schema.json","$schema":"https://json-schema.org/draft/2020-12/schema","additionalProperties":true,"properties":{"activity_id":{"pattern":"^[A-Za-z0-9][A-Za-z0-9._:@-]*$","type":"string"},"activity_type":{"type":"string"},"allow_overlap":{"type":"boolean"},"assumptions":{"additionalProperties":true,"type":"object"},"blocked_precondition_count":{"minimum":0,"type":"integer"},"blocked_precondition_types":{"items":{"type":"string"},"type":"array"},"dependency_activity_ids":{"items":{"pattern":"^[A-Za-z0-9][A-Za-z0-9._:@-]*$","type":"string"},"type":"array"},"dependency_timeline_ids":{"items":{"pattern":"^[A-Za-z0-9][A-Za-z0-9._:@-]*$","type":"string"},"type":"array"},"exclusive_with_activity_ids":{"items":{"pattern":"^[A-Za-z0-9][A-Za-z0-9._:@-]*$","type":"string"},"type":"array"},"exclusive_with_timeline_ids":{"items":{"pattern":"^[A-Za-z0-9][A-Za-z0-9._:@-]*$","type":"string"},"type":"array"},"invalid_activity_input":{"type":"boolean"},"invalid_activity_input_reason":{"type":"string"},"model":{"const":"artifact_only_timeline_activity_precondition_summary","type":"string"},"precondition_status":{"enum":["blocked","clear","review_required"],"type":"string"},"preconditions":{"items":{"additionalProperties":true,"properties":{"field":{"type":"string"},"reason":{"type":"string"},"status":{"enum":["blocked","clear","review_required"],"type":"string"},"type":{"enum":["activity_type_incompatible","activity_type_suppressed","antenna_unavailable","battery_state_of_charge_depleted","command_authority_missing","command_safety_failed","command_safety_unchecked","degraded_mode","downlink_margin_depleted","fuel_margin_depleted","payload_unavailable","power_margin_depleted","resource_block_declared","spacecraft_unavailable","storage_margin_depleted","subsystem_state_required"],"type":"string"},"value":{"type":["string","number","boolean","object"]}},"required":["type","status","field","reason"],"type":"object"},"type":"array"},"review_precondition_count":{"minimum":0,"type":"integer"},"review_precondition_types":{"items":{"type":"string"},"type":"array"},"schema_contract":{"const":"timeline_activity_precondition_summary.v1","type":"string"},"source_activity":{"additionalProperties":true,"type":"object"},"timeline_id":{"pattern":"^[A-Za-z0-9][A-Za-z0-9._:@-]*$","type":"string"},"timeline_identity":{"additionalProperties":true,"properties":{"activity_id":{"pattern":"^[A-Za-z0-9][A-Za-z0-9._:@-]*$","type":"string"},"activity_type":{"type":"string"},"scenario_id":{"pattern":"^[A-Za-z0-9][A-Za-z0-9._:@-]*$","type":"string"},"source_window_id":{"pattern":"^[A-Za-z0-9][A-Za-z0-9._:@-]*$","type":"string"},"subject_id":{"type":"string"},"timeline_id":{"pattern":"^[A-Za-z0-9][A-Za-z0-9._:@-]*$","type":"string"}},"type":"object"},"validation_level":{"const":"artifact_contract","type":"string"}},"required":["schema_contract","model","validation_level","precondition_status","blocked_precondition_count","review_precondition_count","blocked_precondition_types","review_precondition_types","preconditions","assumptions"],"title":"OrbitalDynamics timeline_activity_precondition_summary.v1","type":"object","x-orbital-dynamics":{"artifact_family":"timeline_activity_precondition_summary","compatibility_policy":{"breaking_change_action":"mint a new schema_contract name or increment the artifact schema_version before publishing","breaking_changes":["remove_required_fields","change_required_field_type","change_schema_contract_identifier","change_schema_version_const","change_required_field_semantics"],"compatible_changes":["add_optional_fields","add_optional_nested_contracts","tighten_executable_semantic_validation_without_changing_exported_required_fields"],"policy_version":1,"validation_mode":"top_level_compatibility_export"},"compatibility_policy_version":1,"executable_contract":true,"identity_policy":{"breaking_changes":["change_existing_public_identifier_for_the_same_semantic_entity","emit_blank_identifier","emit_identifier_with_whitespace"],"compatible_changes":["add_optional_identifier_fields","add_more_specific_semantic_source_metadata_without_changing_existing_ids"],"description":"Public artifact identifiers are non-empty machine identifiers without whitespace.","generated_id_scopes":[{"identity_fields":["scenario_id","type","source_window_id","target_id","ground_station_id"],"ordering":["result_event_type","scenario_id","source_window_id","starts_at_s"],"scope":"candidate_refresh.v1.candidate_activities"},{"generated_id_field":"id","identity_fields":["type","scenario_id","target_id","ground_station_id","starts_at_s","ends_at_s"],"ordering":["type","scenario_id","target_id","ground_station_id","starts_at_s","id"],"scope":"candidate_refresh.v1.refreshed_windows.generated_window_id","semantic_invariants":["source_record_order_must_not_change_generated_window_id","canonical_source_event_sort_key_must_drive_window_index","same_semantic_source_window_must_keep_generated_window_id"]},{"identity_fields":["spacecraft_id","scenario_id","epoch.seconds_since_j2000"],"ordering":["spacecraft_id","scenario_id","epoch.seconds_since_j2000"],"scope":"accepted_planning_state.v1.spacecraft_states"},{"generated_id_field":"id","identity_fields":["resource_scope","ground_station_id","spacecraft_id","starts_at_s","ends_at_s","contact_ids"],"ordering":["resource_scope","ground_station_id","spacecraft_id","starts_at_s","id"],"scope":"contact_contention_report.v1.conflict_groups.generated_group_id","semantic_invariants":["source_record_order_must_not_change_generated_group_id","canonical_contact_sort_key_must_drive_conflict_group_index","same_semantic_contention_group_must_keep_generated_group_id"]},{"generated_id_field":"group_id","identity_fields":["group_id","resource_scope","ground_station_id","spacecraft_id","starts_at_s","selected_contact_id","deferred_contact_ids"],"ordering":["resource_scope","ground_station_id","spacecraft_id","starts_at_s","group_id"],"scope":"contact_contention_resolution_report.v1.recommendations.generated_group_id","semantic_invariants":["contention_group_id_must_flow_to_recommendation_group_id","source_record_order_must_not_change_recommendation_group_id","resolution_ordering_must_not_change_group_identity"]},{"explicit_id_fields":["route_id","id","data_path_id"],"identity_fields":["source_spacecraft_id","relay_chain_spacecraft_ids","ground_station_id","ground_downlink_contact_id","latency_s","latency_limit_s","product_ids","collection_ids"],"ordering":["source_spacecraft_id","ground_downlink_contact_id","semantic_route_fingerprint"],"scope":"relay_data_path_summary.v1.rows.generated_route_id","semantic_invariants":["source_record_order_must_not_change_generated_route_id","semantic_route_evidence_changes_must_change_generated_route_id","explicit_route_id_takes_precedence_over_generated_route_id"]}],"policy_version":1,"semantic_invariants":["source_record_order_must_not_change_generated_identity","semantic_source_identity_must_remain_stable_across_manifest_export","scenario_and_activity_identity_must_not_depend_on_wall_clock_time"],"stable_id_pattern":"^[A-Za-z0-9][A-Za-z0-9._:@-]*$"},"identity_policy_version":1,"nested_contract_definition_scope":"direct_declared_contracts","nested_contracts":[],"schema_contract":"timeline_activity_precondition_summary.v1","schema_version":1,"validation_mode":"top_level_compatibility_export"}}
